{
  "formatVersion": 1,
  "kind": "learnlab-author-preview",
  "pack": {
    "formatVersion": 1,
    "version": 3,
    "stateVersion": 1,
    "id": "research-station",
    "title": "Bring the research station back online",
    "description": "A storm has silenced the research station. Restore its beacon by finding a complete path for charge.",
    "audience": "Learners approaching A-level physics, with optional GCSE bridges; curious adult explorers welcome",
    "level": "Introduction bridging GCSE to A-level DC circuits",
    "subject": {
      "id": "physics",
      "title": "Physics"
    },
    "capabilities": {
      "experience-graph": "0.1.1",
      "activity-plugin": "0.1.0",
      "choice": "0.1.0",
      "circuit": "0.1.0"
    },
    "skills": [
      {
        "id": "capability-1",
        "title": "Explain closed-path charge flow and distinguish current from charge",
        "criterion": "Correct mechanism prediction and applicable numeric/design task with correct units; at least two fresh independent opportunities, not completion count",
        "prerequisites": []
      }
    ],
    "episodes": [
      {
        "id": "close-the-loop",
        "title": "The dark beacon",
        "estimatedMinutes": 8,
        "skills": [
          "capability-1"
        ],
        "prerequisites": [],
        "start": "first-action",
        "nodes": [
          {
            "id": "first-action",
            "title": "Wake the beacon",
            "prompt": "The beacon is dark. Two links were opened during the storm. Make a complete conducting path to bring it online. Try either link first.",
            "role": "practice",
            "activity": {
              "type": "circuit",
              "initial": {
                "voltage": 6,
                "circuit": {
                  "type": "series",
                  "elements": [
                    {
                      "type": "switch",
                      "id": "supply-link",
                      "closed": false
                    },
                    {
                      "type": "resistor",
                      "id": "beacon",
                      "ohms": 6
                    },
                    {
                      "type": "switch",
                      "id": "return-link",
                      "closed": false
                    }
                  ]
                }
              },
              "solution": {
                "voltage": 6,
                "circuit": {
                  "type": "series",
                  "elements": [
                    {
                      "type": "switch",
                      "id": "supply-link",
                      "closed": true
                    },
                    {
                      "type": "resistor",
                      "id": "beacon",
                      "ohms": 6
                    },
                    {
                      "type": "switch",
                      "id": "return-link",
                      "closed": true
                    }
                  ]
                }
              },
              "labels": {
                "supply-link": "Supply link",
                "beacon": "Beacon heater",
                "return-link": "Return link"
              },
              "controls": [
                {
                  "id": "supply-link",
                  "values": [
                    false,
                    true
                  ]
                },
                {
                  "id": "return-link",
                  "values": [
                    false,
                    true
                  ]
                }
              ],
              "goals": [
                {
                  "reading": "source",
                  "quantity": "current",
                  "min": 0.999,
                  "max": 1.001
                }
              ]
            },
            "hints": [
              "Trace from one supply terminal, through the heater, and back to the other terminal.",
              "A break anywhere in this single path stops the steady current. Find every break."
            ],
            "workedExample": "Close both links. With the path complete, the 6 V supply drives 1 A through the 6 ohm heater. Reopening either link stops it; the heater has not used up charge.",
            "mechanism": "The supply transfers energy to charge already in the conducting circuit. A complete conducting path allows a steady current. The heater transfers energy, rather than consuming charge. In this one-path ideal circuit, the same current passes every point.",
            "transitions": {
              "passed": "predict-break",
              "assisted": "predict-break"
            },
            "bridge": "A steady current needs a complete conducting path. The source transfers energy; charge is conserved. You can return to the map and explore later."
          },
          {
            "id": "predict-break",
            "title": "What if the return link opens?",
            "prompt": "The beacon is running. Predict the steady current near the supply after only the return link opens. Then test your idea.",
            "role": "prediction",
            "activity": {
              "type": "choice",
              "options": [
                {
                  "id": "near-source",
                  "text": "It keeps flowing near the supply, but not after the gap.",
                  "correct": false,
                  "feedback": "Steady charge cannot keep piling up at the gap. A break interrupts the entire single path."
                },
                {
                  "id": "used-up",
                  "text": "It falls because the heater consumes the charge.",
                  "correct": false,
                  "feedback": "The heater transfers energy from moving charge. Charge is conserved; the missing conducting path causes the stop."
                },
                {
                  "id": "zero",
                  "text": "It falls to zero throughout the path.",
                  "correct": true,
                  "feedback": "Yes. A return-side break interrupts the same complete path as a supply-side break."
                }
              ]
            },
            "hints": [
              "Follow the entire path, including the return side."
            ],
            "workedExample": "In a single loop, removing a connection on either side of the load stops the steady current everywhere.",
            "mechanism": "The supply transfers energy to charge already in the conducting circuit. A complete conducting path allows a steady current. The heater transfers energy, rather than consuming charge. In this one-path ideal circuit, the same current passes every point.",
            "transitions": {
              "passed": "break-test",
              "assisted": "break-test"
            },
            "bridge": "A steady current needs a complete conducting path. The source transfers energy; charge is conserved. You can return to the map and explore later."
          },
          {
            "id": "break-test",
            "title": "Test the return-side fault",
            "prompt": "Open the return link and watch the meter. You can also compare opening the supply link, or restore the beacon again before leaving. The goal is a stopped current.",
            "role": "practice",
            "activity": {
              "type": "circuit",
              "initial": {
                "voltage": 6,
                "circuit": {
                  "type": "series",
                  "elements": [
                    {
                      "type": "switch",
                      "id": "supply-link",
                      "closed": true
                    },
                    {
                      "type": "resistor",
                      "id": "beacon",
                      "ohms": 6
                    },
                    {
                      "type": "switch",
                      "id": "return-link",
                      "closed": true
                    }
                  ]
                }
              },
              "solution": {
                "voltage": 6,
                "circuit": {
                  "type": "series",
                  "elements": [
                    {
                      "type": "switch",
                      "id": "supply-link",
                      "closed": true
                    },
                    {
                      "type": "resistor",
                      "id": "beacon",
                      "ohms": 6
                    },
                    {
                      "type": "switch",
                      "id": "return-link",
                      "closed": false
                    }
                  ]
                }
              },
              "labels": {
                "supply-link": "Supply link",
                "beacon": "Beacon heater",
                "return-link": "Return link"
              },
              "controls": [
                {
                  "id": "supply-link",
                  "values": [
                    false,
                    true
                  ]
                },
                {
                  "id": "return-link",
                  "values": [
                    false,
                    true
                  ]
                }
              ],
              "goals": [
                {
                  "reading": "source",
                  "quantity": "current",
                  "min": 0,
                  "max": 0
                }
              ]
            },
            "hints": [
              "Try the return link. Compare the source current with the reading across the heater."
            ],
            "workedExample": "Open the return link. Current becomes 0 A, heater power 0 W. With just one break the source voltage appears across that break.",